{"schema_version":"evidence-card/1.0","record_id":"10.1093/epolic/eiae042","zotero_item_key":null,"bibtex_key":"acemoglu2025simple","title":"The Simple Macroeconomics of AI","authors":["Daron Acemoglu"],"year":2025,"venue":"Economic Policy 40(121)","doi":"10.1093/epolic/eiae042","verification":{"level":"claim-verified","sources":[{"type":"fulltext","path":"work/runs/ai-token-economics-v1/curator-fulltext/acemoglu-simple-macro-2024.pdf","version":"NBER WP 32487, May 2024"}]},"research_question":"How large are plausible medium-run macroeconomic productivity, wage and inequality effects of AI?","theory":["task-based production","Hulten aggregation"],"mechanisms":["automation","task complementarity","new tasks"],"data":{"type":"calibration from exposure and task-level productivity estimates","geography":"United States","horizon":"10 years"},"method":{"design":"task-based macro calibration","evidence_grade":"D","boundary":"conditional projection, not causal aggregate estimate"},"findings":[{"claim":"Under the paper's exposure and task-cost assumptions, projected TFP gains over ten years are modest and below 0.53% after adjusting for hard-to-learn tasks.","locator":"NBER version, abstract and Sections 3-4","evidence_kind":"text"},{"claim":"Task-level gains for lower-skill workers do not by themselves imply reduced inequality; capital-labor income gaps may widen.","locator":"NBER version, abstract and inequality analysis","evidence_kind":"text"}],"limitations":["Calibration depends on exposure and cost-saving assumptions.","US-centered evidence; fast model change limits transportability."],"relevance":{"clusters":["macro growth","distribution"],"use":"cautious macro anchor"},"fulltext":{"status":"local-only","inspected":true,"source_url":"https://www.nber.org/papers/w32487"}}
