{"schema_version":"evidence-card/1.0","record_id":"10.3386/w33777","zotero_item_key":null,"bibtex_key":"humlumvestergaard2025","title":"Still Waters, Rapid Currents: Early Labor Market Transformation under Generative AI","authors":["Anders Humlum","Emilie Vestergaard"],"year":2025,"venue":"NBER Working Paper 33777, revised March 2026","doi":"10.3386/w33777","verification":{"level":"claim-verified","sources":[{"type":"fulltext","path":"work/runs/ai-token-economics-v1/curator-fulltext/humlum-vestergaard-2025.pdf","version":"March 2026 revision"}]},"research_question":"How does early chatbot adoption reshape tasks, earnings, hours and mobility in highly exposed occupations?","theory":["task reorganization","organizational complements"],"mechanisms":["new AI tasks","oversight and integration","occupational mobility"],"data":{"type":"linked representative surveys and administrative records","sample":"25,000 workers in 7,000 Danish workplaces across 11 exposed occupations","period":"through December 2024"},"method":{"design":"worker- and workplace-level difference-in-differences","evidence_grade":"C","boundary":"adoption is not randomized; design compares adopters and non-adopters"},"findings":[{"claim":"The estimates center near zero for earnings and recorded hours and rule out average effects larger than 2% two years after ChatGPT's launch.","locator":"March 2026 revision, abstract and pp. 3-5","evidence_kind":"text"},{"claim":"Adoption is associated with task reorganization, new oversight/integration tasks and limited occupational mobility before average earnings or hours move.","locator":"March 2026 revision, pp. 2-6","evidence_kind":"text"}],"limitations":["Highly exposed Danish occupations may not generalize globally.","Early two-year horizon may miss longer-run adjustments.","Adoption differences can retain selection despite DiD checks."],"relevance":{"clusters":["labor market","organization"],"use":"bridge from workplace reorganization to aggregate null effects"},"fulltext":{"status":"local-only","inspected":true,"source_url":"https://www.nber.org/papers/w33777"}}
