{"schema_version":"evidence-card/1.0","record_id":"10.3386/w32966","zotero_item_key":null,"bibtex_key":"bickblandindeming2024","title":"The Rapid Adoption of Generative AI","authors":["Alexander Bick","Adam Blandin","David J. Deming"],"year":2024,"venue":"NBER Working Paper 32966, revised February 2025","doi":"10.3386/w32966","verification":{"level":"claim-verified","sources":[{"type":"fulltext","path":"work/runs/ai-token-economics-v1/curator-fulltext/bick-blandin-deming-2024.pdf","version":"February 2025 revision"}]},"research_question":"How quickly and intensively are US adults adopting generative AI at work and at home?","theory":["technology diffusion"],"mechanisms":["adoption extensive margin","use intensity"],"data":{"type":"nationally representative Real-Time Population Survey","sample":"more than 10,000 respondents in August and November 2024","geography":"United States"},"method":{"design":"weighted repeated cross-sectional survey benchmarked to CPS","evidence_grade":"D","boundary":"self-reported use and time savings; not a causal productivity estimate"},"findings":[{"claim":"By late 2024, 39% of US adults age 18-64 reported generative-AI use and 23% of employed respondents used it for work in the prior week.","locator":"February 2025 revision, abstract and pp. 3-4","evidence_kind":"text"},{"claim":"Respondents reported AI assistance over roughly 1-5% of work hours and time savings equivalent to 1.4% of work hours.","locator":"February 2025 revision, abstract","evidence_kind":"text"}],"limitations":["Use and time savings are self-reported.","Early diffusion patterns do not identify employment or productivity effects."],"relevance":{"clusters":["adoption","labor and tasks"],"use":"diffusion measurement"},"fulltext":{"status":"local-only","inspected":true,"source_url":"https://www.nber.org/papers/w32966"}}
