{"schema_version":"evidence-card/1.0","record_id":"10.1093/qje/qjae044","zotero_item_key":null,"bibtex_key":"brynjolfssonliraymond2025","title":"Generative AI at Work","authors":["Erik Brynjolfsson","Danielle Li","Lindsey R. Raymond"],"year":2025,"venue":"Quarterly Journal of Economics","doi":"10.1093/qje/qjae044","verification":{"level":"claim-verified","sources":[{"type":"fulltext","path":"work/runs/ai-token-economics-v1/curator-fulltext/brynjolfsson-li-raymond-2025.pdf","version":"NBER WP 31161, revised November 2023"}]},"research_question":"What happens to customer-support productivity and worker outcomes when a generative-AI assistant is deployed at scale?","theory":["tacit knowledge diffusion","skill heterogeneity"],"mechanisms":["recommendation adherence","best-practice diffusion","learning"],"data":{"type":"operational data","sample":"5,179 customer-support agents","setting":"staggered assistant deployment at a Fortune 500 software firm"},"method":{"design":"staggered rollout with panel comparisons","evidence_grade":"C","boundary":"one firm and occupation; rollout not described as randomized"},"findings":[{"claim":"Access increased issues resolved per hour by 14% on average, with larger gains for novice and lower-skill agents.","locator":"NBER version, abstract and pp. 1-2","evidence_kind":"text"},{"claim":"Results are consistent with best-practice diffusion and learning, while the study does not identify aggregate employment or wage effects.","locator":"NBER version, pp. 2-4","evidence_kind":"text"}],"limitations":["Single firm and customer-support workflow.","Cannot be extrapolated to aggregate employment, wages or all occupations."],"relevance":{"clusters":["labor productivity","firm organization"],"use":"field evidence on augmentation and heterogeneity"},"fulltext":{"status":"local-only","inspected":true,"source_url":"https://www.nber.org/papers/w31161"}}
